Company,Website,Industry,Product/Service Category,"Business Type (B2B, B2B2C)",Employees Count,Revenue,Year Founded,BBB Rating,Street,City,State,Company Phone,Company LinkedIn,Owner's First Name,Owner's Last Name,Owner's Title,Owner's LinkedIn,Owner's Phone Number,Owner's Email,Source
Leverage Software Inc,leveragesoftware.com,Computer Software Developers,,B2B,0,Revenue not disclosed publicly.,2003,N/A,150 S Park St,San Francisco,CA,(415)-946-6161,linkedin.com/company/leverage-software,Could not locate a first name.,Could not locate a last name.,Position information missing.,LinkedIn information missing.,Phone number unavailable.,Email not available.,Growjo + Apollo
Software Developer,thesoda.io,Computer Software Developers,"software development, information technology & services",B2B,35,$4.1M,2014,N/A,100 california street,san francisco,ca,N/A,linkedin.com/company/thesoda,Could not locate a first name.,Last name unavailable.,No job title found.,Could not find a LinkedIn profile.,Phone information missing.,Email not available.,Growjo + Apollo
Nitro Pdf Software,nitropdf.com,Computer Software Developers,,N/A,0,Revenue details were not available.,0,N/A,575 Market St Ste 3625,San Francisco,CA,(415)-369-9296,No LinkedIn profile found.,First name unavailable.,Last name unavailable.,Title not specified.,LinkedIn link not available.,No phone contact found.,Email information missing.,Growjo + Apollo
Best Western Grant Park Hotel,bestwestern.com,4-Star Hotel,,B2C,0,Financial data is currently unavailable.,1946,N/A,1100 S Michigan Ave,Chicago,IL,(312)-922-2900,linkedin.com/company/best-western-hotels-&-resorts,Mark,Hoefling,Vice President Operations,linkedin.com/in/mark-hoefling-1495538,Phone information missing.,mark.hoefling@bestwestern.com,Growjo + Apollo
Symphony Development,symphonydevelopment.com,Real Estate Developers,,B2B,0,Revenue details were not available.,0,N/A,10866 Wilshire Blvd Ste 225,Los Angeles,CA,(310)-474-7349,linkedin.com/company/symphony-development,First name unavailable.,Could not locate a last name.,Title not specified.,LinkedIn information missing.,Phone information missing.,Email information missing.,Growjo + Apollo
